{
  "metadata": {
    "schema_version": "2.0",
    "content_version": "1.0",
    "revision": 1,
    "generated_by": {
      "type": "ai",
      "provider": "deepseek",
      "model": "deepseek-chat"
    }
  },
  "episode_id": "travel_new_york_city_ep001",
  "scene_id": "S013",
  "target_language": "en",
  "cefr_level": "A2",
  "mode": "monologue",
  "protagonist_ref": "CHAR_JIEUN_001",
  "b_gender": null,
  "lines": [
    {
      "line_id": "L001",
      "sequence": 1,
      "speaker": "A",
      "text": "Oh, we're moving again. That's a relief."
    },
    {
      "line_id": "L002",
      "sequence": 2,
      "speaker": "A",
      "text": "I can see the city lights now. It looks beautiful."
    },
    {
      "line_id": "L003",
      "sequence": 3,
      "speaker": "A",
      "text": "I need to watch for my stop. I don't want to miss it."
    }
  ],
  "scene_state": {
    "location_ref": "LOC_AIRPORT_TRANSIT_001",
    "carry_in": [
      "The subway train has stopped between stations",
      "Jieun is feeling anxious about the delay",
      "She is wondering if she will reach her hotel on time"
    ],
    "carry_out": [
      "The subway train has resumed moving",
      "Jieun feels relieved and is now watching for her stop",
      "She is looking forward to arriving at her hotel"
    ],
    "emotion": "relieved and hopeful"
  },
  "validation": {
    "expected_line_count": 3,
    "actual_line_count": 3
  }
}
